{
  "$schema": "../../ontology/schema/ice-comparator-protocol-v1.schema.json",
  "schema_version": "ice-comparator-protocol/v1",
  "protocol_id": "comparator-protocol:ice-choice-robust-cross-domain",
  "title": "ICE external-comparator choice-robustness protocol",
  "description": "A non-authoritative, design-only route for separating implementation calibration, modified-gravity comparison, and folded-seam classification. It records no computation, observation, claim, or canonical-graph change.",
  "updated_at_utc": "2026-09-03T00:00:00Z",
  "authority": "NON_AUTHORITATIVE_METHOD_PROTOCOL",
  "canonical_graph_unchanged": true,
  "does_not_authorize_execution": true,
  "result_status": "DESIGN_ONLY",
  "selected_strategy": {
    "calibration_step": "route-step:jbd-gr-limit-calibration",
    "first_comparator_model": "route-model:hu-sawicki-n1",
    "cross_domain_step": "route-step:hu-sawicki-n1-cross-domain",
    "ice_admission_step": "route-step:geometry-ice-admission-decision",
    "parallel_classification_step": "route-step:folded-wess-zumino-seam-classification",
    "rationale": "First establish a declared JBD reference-limit calibration, then audit a fixed Hu-Sawicki n=1 comparator across independently defined consumers. Any later ICE admission remains conditional on a specified action and invariant observables; folded-seam classification is explicitly parallel rather than a premise or corroboration."
  },
  "source_pins": [
    {
      "id": "source-pin:brans-dicke-1961",
      "kind": "PRIMARY_PAPER",
      "citation": "C. Brans and R. H. Dicke, Mach's Principle and a Relativistic Theory of Gravitation, Physical Review 124, 925 (1961).",
      "uri": "https://journals.aps.org/pr/abstract/10.1103/PhysRev.124.925",
      "version": "Published 1961-11-01; DOI 10.1103/PhysRev.124.925",
      "retrieved_at_utc": "2026-09-03T00:00:00Z",
      "pinpoint": "Published article metadata and the stated scalar-tensor action convention to be selected before calibration.",
      "role": "Primary reference for the declared Jordan-Brans-Dicke calibration model.",
      "boundary": "This source is a comparator specification, not ICE evidence or an ICE derivation."
    },
    {
      "id": "source-pin:hu-sawicki-2007",
      "kind": "PRIMARY_PAPER",
      "citation": "W. Hu and I. Sawicki, Models of cosmic acceleration that evade solar system tests, Physical Review D 76, 064004 (2007).",
      "uri": "https://doi.org/10.1103/PhysRevD.76.064004",
      "version": "Published 2007-09-10; arXiv:0705.1158v1",
      "retrieved_at_utc": "2026-09-03T00:00:00Z",
      "pinpoint": "Metric-variation model definition and n=1 parameterization; high-curvature branch conditions must be separately declared.",
      "role": "Primary reference for the fixed n=1 Hu-Sawicki comparator.",
      "boundary": "A viable comparator class is not evidence that ICE supplies its action, scalar mode, or screening mechanism."
    },
    {
      "id": "source-pin:wess-zumino-1974",
      "kind": "PRIMARY_PAPER",
      "citation": "J. Wess and B. Zumino, Supergauge Transformations in Four Dimensions, Physics Letters B 49, 52-54 (1974).",
      "uri": "https://doi.org/10.1016/0370-2693(74)90578-4",
      "version": "Published 1974; DOI 10.1016/0370-2693(74)90578-4",
      "retrieved_at_utc": "2026-09-03T00:00:00Z",
      "pinpoint": "Local supersymmetry comparator for distinguishing a fermion-odd charge from a temporal or sheet sewing operation.",
      "role": "Primary reference for the folded Wess-Zumino seam classification comparator.",
      "boundary": "It neither constructs a CPT/Pin sewing nor validates a folded ICE supercharge."
    },
    {
      "id": "source-pin:heftcamb-2026",
      "kind": "OFFICIAL_COLLABORATION_PAPER",
      "citation": "G. Ye et al., H-EFTCAMB: A Cobaya-Integrated, Python-Wrapped Extension of EFTCAMB for Covariant Horndeski Gravity, arXiv:2603.01662.",
      "uri": "https://arxiv.org/abs/2603.01662",
      "version": "arXiv:2603.01662; official EFTCAMB collaboration record",
      "retrieved_at_utc": "2026-09-03T00:00:00Z",
      "pinpoint": "Code-paper description of a separately implemented linear modified-gravity calculation route.",
      "role": "Official collaboration source for the uninstalled H-EFTCAMB tool pin.",
      "boundary": "Tool availability or an external implementation is not a calculation, calibration, or independent ICE result."
    },
    {
      "id": "source-pin:hi-class-2020",
      "kind": "OFFICIAL_COLLABORATION_PAPER",
      "citation": "E. Bellini, I. Sawicki, and M. Zumalacarregui, hi_class: Background Evolution, Initial Conditions and Approximation Schemes, JCAP 02 (2020) 008.",
      "uri": "https://arxiv.org/abs/1909.01828",
      "version": "arXiv:1909.01828; JCAP 02 (2020) 008",
      "retrieved_at_utc": "2026-09-03T00:00:00Z",
      "pinpoint": "Code-paper description of an independently maintained linear cosmology formulation including Brans-Dicke examples.",
      "role": "Official collaboration source for the uninstalled hi_class tool pin.",
      "boundary": "A second independently maintained code family is only a conditional numerical check after the action-to-code maps, conventions, and parameters are audited and fixed; it is not independent physical validation."
    }
  ],
  "tools": [
    {
      "id": "route-tool:h-eftcamb",
      "name": "H-EFTCAMB",
      "repository_uri": "https://github.com/EFTCAMB/EFTCAMB",
      "observed_commit": "16d9c4e9f85751e30efd0a53b177941713078904",
      "observed_at_utc": "2026-09-03T00:00:00Z",
      "paper_source_ref": "source-pin:heftcamb-2026",
      "role": "Planned external implementation for a convention-matched modified-gravity cross-check.",
      "license_status": "Repository licence must be reviewed before any installation or use.",
      "installation_status": "NOT_INSTALLED",
      "boundary": "This is a source pin only: no installation, run, likelihood, or output is recorded."
    },
    {
      "id": "route-tool:hi-class",
      "name": "hi_class",
      "repository_uri": "https://github.com/hiclass-code/hi_class_public",
      "observed_commit": "0009f51d89e6465c79e570b496c66fc90058fa77",
      "observed_at_utc": "2026-09-03T00:00:00Z",
      "paper_source_ref": "source-pin:hi-class-2020",
      "role": "Planned independently maintained implementation for a matched numerical cross-domain check, not an independent physical derivation.",
      "license_status": "Repository licence must be reviewed before any installation or use.",
      "installation_status": "NOT_INSTALLED",
      "boundary": "This is a source pin only: no installation, run, likelihood, or output is recorded."
    }
  ],
  "models": [
    {
      "id": "route-model:jbd-calibration",
      "role": "CALIBRATION_ONLY",
      "name": "Jordan-Brans-Dicke declared GR-limit calibration",
      "action": "S_JBD=(16 pi)^-1 int d^4x sqrt(-g)[Phi R-omega_BD Phi^-1 (nabla Phi)^2-2 V(Phi)]+S_m[g,psi], with V(Phi) fixed before comparison.",
      "convention": "Metric signature, Riemann sign, action normalization, Jordan-frame matter coupling, and scalar boundary conditions are fixed in the planned input ledger.",
      "parameter_lock": "One declared omega_BD trajectory, potential choice, background parameters, and GR-limit prescription; no post-comparison retuning.",
      "matter_coupling": "Universal minimally coupled matter in the declared Jordan frame only.",
      "boundary_domain": "Calibration is limited to the stated action, branch, boundary conditions, and reference-limit observables.",
      "source_refs": ["source-pin:brans-dicke-1961", "source-pin:hi-class-2020"],
      "non_claim": "Reproducing a reference limit would test implementation fidelity only; it would not support ICE or establish a new gravitational mechanism."
    },
    {
      "id": "route-model:hu-sawicki-n1",
      "role": "CANDIDATE_MODEL",
      "name": "Hu-Sawicki metric f(R) n=1 comparator",
      "action": "S=int d^4x sqrt(-g)[(R+f_HS(R))/(2 kappa^2)+L_m], with f_HS(R)=-m^2 c1(R/m^2)/[c2(R/m^2)+1] for n=1; the scalar degree of freedom and high-curvature branch are declared model content.",
      "convention": "Metric variation, f_R definition, curvature sign, action normalization, and the mapping between c1, c2 and f_R0 are frozen before any comparison.",
      "parameter_lock": "One n=1 branch, one stated f_R0 or equivalent c1/c2 value, one background parameter set, and one screening/environment prescription across all consumers.",
      "matter_coupling": "Matter coupling and environmental screening assumptions are stated as part of the comparator, not imported from ICE.",
      "boundary_domain": "Only the declared metric-variation n=1 model and viability branch are compared; no generic f(R), JBD equivalence, or matter-geometrization conclusion follows.",
      "source_refs": ["source-pin:hu-sawicki-2007", "source-pin:heftcamb-2026", "source-pin:hi-class-2020"],
      "non_claim": "This candidate comparator is not an ICE action and a fit in one consumer would not establish a common mechanism."
    },
    {
      "id": "route-model:folded-wess-zumino-seam",
      "role": "PARALLEL_CLASSIFICATION",
      "name": "Folded Wess-Zumino seam classification comparator",
      "action": "A local Wess-Zumino comparator with a separately declared seam or sheet label, used only to classify whether a proposed operation is a fermion-odd supercharge or a distinct sewing map.",
      "convention": "Specify the Hilbert-space domain, grading, complex-linearity, charge adjoint, and seam boundary data before classification.",
      "parameter_lock": "One fixed local multiplet and one seam operation; no tuning of a mass spectrum, state occupation, or sheet basis after classification.",
      "matter_coupling": "No cosmological matter coupling is inferred; this is an algebraic/domain classification only.",